{
  "mfo": "1.0",
  "software": "Aval (siesa-doc)",
  "versao": "5.0.0",
  "proposito": "Exemplo real: medir o feature set Usuários (ADM-USR) a partir dos N3 e comparar com a extração mecânica e com a contagem APF existente",
  "escopo": "Feature set ADM-USR (6 features N3: ADM-USR-01 a ADM-USR-06)",
  "nivel": "R",
  "agente": {
    "tipo": "ia",
    "nome": "assistente de medição (leitura dos N3 com as regras RI-01 a RI-11)",
    "revisao_humana": false,
    "prompt": "prompts/extracao-mfc.md@1.0"
  },
  "fontes": [
    {
      "id": "DOC",
      "tipo": "requisitos",
      "ref": "siesa-doc@49265a9 (VERSION 5.0.0)"
    }
  ],
  "usuarios_funcionais": [
    {
      "id": "UF-ADM",
      "nome": "Administrador da conta",
      "tipo": "pessoa"
    },
    {
      "id": "UF-CONVIDADO",
      "nome": "Pessoa convidada (abre o link do convite)",
      "tipo": "pessoa"
    },
    {
      "id": "UF-GOOGLE",
      "nome": "Identidade Google (OIDC)",
      "tipo": "sistema"
    },
    {
      "id": "UF-EMAIL",
      "nome": "Serviço de e-mail (SMTP)",
      "tipo": "sistema"
    }
  ],
  "entidades": [
    {
      "id": "Usuario",
      "descricao": "Vínculo de uma pessoa com a conta, com perfil e situação",
      "evidencia": [
        "DOC:global/data-models/administracao.md#Usuario"
      ]
    },
    {
      "id": "Convite",
      "descricao": "Convite pendente, aceito, cancelado ou expirado",
      "evidencia": [
        "DOC:global/data-models/administracao.md#Convite"
      ]
    },
    {
      "id": "Perfil",
      "descricao": "Perfil de acesso da organização",
      "evidencia": [
        "DOC:global/data-models/administracao.md#Perfil"
      ]
    },
    {
      "id": "Pessoa",
      "descricao": "Pessoa física com credenciais (senha ou Google)",
      "evidencia": [
        "DOC:global/data-models/administracao.md#Pessoa"
      ]
    },
    {
      "id": "Conta",
      "descricao": "Conta/organização",
      "evidencia": [
        "DOC:global/data-models/administracao.md#Conta"
      ]
    },
    {
      "id": "EventoAuditoria",
      "descricao": "Trilha de auditoria consultável (ADM-AUD-01)",
      "evidencia": [
        "DOC:global/data-models/administracao.md#EventoAuditoria"
      ]
    },
    {
      "id": "Identidade Google",
      "descricao": "Identidade do provedor no login social (sistema externo)",
      "evidencia": [
        "DOC:global/DATA-MODEL.md#Identidade Google"
      ]
    }
  ],
  "processos": [
    {
      "id": "ADM-USR-01",
      "nome": "Pesquisar usuários",
      "disparadores": [
        {
          "usuario": "UF-ADM",
          "evento": "abre a tela de usuários ou informa a busca"
        }
      ],
      "evidencia": [
        "DOC:modules/administracao/usuarios/f-pesquisar-usuarios.md#Descrição",
        "DOC:modules/administracao/usuarios/f-pesquisar-usuarios.md#API"
      ],
      "apf": {
        "pf": 5,
        "tipo": "SE"
      },
      "movimentos": [
        {
          "tipo": "E",
          "entidade": "Usuario",
          "evidencia": [
            "DOC:modules/administracao/usuarios/f-pesquisar-usuarios.md#Campos"
          ],
          "nota": "filtro de busca por nome ou e-mail"
        },
        {
          "tipo": "R",
          "entidade": "Usuario",
          "evidencia": [
            "DOC:modules/administracao/usuarios/f-pesquisar-usuarios.md#Memória de cálculo"
          ]
        },
        {
          "tipo": "R",
          "entidade": "Perfil",
          "evidencia": [
            "DOC:modules/administracao/usuarios/f-pesquisar-usuarios.md#Dados lidos e gravados"
          ],
          "nota": "nome do perfil nas linhas"
        },
        {
          "tipo": "X",
          "entidade": "Usuario",
          "evidencia": [
            "DOC:modules/administracao/usuarios/f-pesquisar-usuarios.md#Colunas do resultado"
          ],
          "nota": "linhas e contagens derivadas (total, ativos, pendentes, inativos)"
        },
        {
          "tipo": "X",
          "entidade": "Perfil",
          "evidencia": [
            "DOC:modules/administracao/usuarios/f-pesquisar-usuarios.md#Colunas do resultado"
          ],
          "nota": "RI-06 a: nome do perfil pertence a Perfil"
        }
      ],
      "desfechos": [
        {
          "id": "VALIDATION_ERROR",
          "descricao": "parâmetros fora do domínio",
          "tipo": "recusa",
          "evidencia": [
            "DOC:modules/administracao/usuarios/f-pesquisar-usuarios.md#API"
          ]
        }
      ]
    },
    {
      "id": "ADM-USR-02",
      "nome": "Convidar usuário",
      "disparadores": [
        {
          "usuario": "UF-ADM",
          "evento": "submete e-mail e perfil no modal de convite"
        }
      ],
      "evidencia": [
        "DOC:modules/administracao/usuarios/f-convidar-usuario.md#Descrição",
        "DOC:modules/administracao/usuarios/f-convidar-usuario.md#API"
      ],
      "apf": {
        "pf": 9,
        "tipo": "EE"
      },
      "movimentos": [
        {
          "tipo": "E",
          "entidade": "Convite",
          "evidencia": [
            "DOC:modules/administracao/usuarios/f-convidar-usuario.md#Campos"
          ],
          "nota": "e-mail e perfilId são atributos do convite (RI-03 b)"
        },
        {
          "tipo": "R",
          "entidade": "Perfil",
          "evidencia": [
            "DOC:modules/administracao/usuarios/f-convidar-usuario.md#Memória de cálculo"
          ],
          "nota": "opções do combobox e validação"
        },
        {
          "tipo": "X",
          "entidade": "Perfil",
          "evidencia": [
            "DOC:modules/administracao/usuarios/f-convidar-usuario.md#Métricas de tamanho"
          ],
          "nota": "combobox de perfis: R+X dentro do processo (RI-04 b)"
        },
        {
          "tipo": "R",
          "entidade": "Usuario",
          "evidencia": [
            "DOC:modules/administracao/usuarios/f-convidar-usuario.md#Regras de negócio"
          ],
          "nota": "regra 2: e-mail não pode pertencer a usuário ativo da organização — lê para decidir (RI-07 b)"
        },
        {
          "tipo": "W",
          "entidade": "Convite",
          "evidencia": [
            "DOC:modules/administracao/usuarios/f-convidar-usuario.md#Dados lidos e gravados"
          ]
        },
        {
          "tipo": "W",
          "entidade": "Usuario",
          "evidencia": [
            "DOC:modules/administracao/usuarios/f-convidar-usuario.md#Dados lidos e gravados"
          ],
          "nota": "linha provisória"
        },
        {
          "tipo": "W",
          "entidade": "EventoAuditoria",
          "evidencia": [
            "DOC:modules/administracao/usuarios/f-convidar-usuario.md#Eventos"
          ],
          "nota": "RegistradorAuditoria consome convite.criado; trilha exigida pelo usuário (RI-08 c)"
        },
        {
          "tipo": "X",
          "entidade": "Convite",
          "evidencia": [
            "DOC:modules/administracao/usuarios/f-convidar-usuario.md#API"
          ],
          "nota": "resposta 201 e e-mail ao convidado pelo serviço SMTP (mesma chave: conta uma vez, RI-09 a)"
        }
      ],
      "desfechos": [
        {
          "id": "CONVITE_EMAIL_ACTIVE",
          "descricao": "e-mail já ativo ou convite pendente",
          "tipo": "recusa",
          "evidencia": [
            "DOC:modules/administracao/usuarios/f-convidar-usuario.md#API"
          ]
        },
        {
          "id": "RESOURCE_NOT_FOUND",
          "descricao": "perfil de outra conta ou inexistente",
          "tipo": "recusa",
          "evidencia": [
            "DOC:modules/administracao/usuarios/f-convidar-usuario.md#API"
          ]
        },
        {
          "id": "VALIDATION_ERROR",
          "descricao": "e-mail fora do formato",
          "tipo": "recusa",
          "evidencia": [
            "DOC:modules/administracao/usuarios/f-convidar-usuario.md#API"
          ]
        }
      ]
    },
    {
      "id": "ADM-USR-03",
      "nome": "Alterar perfil do usuário",
      "disparadores": [
        {
          "usuario": "UF-ADM",
          "evento": "escolhe novo perfil para um usuário"
        }
      ],
      "evidencia": [
        "DOC:modules/administracao/usuarios/f-alterar-perfil-do-usuario.md#Descrição",
        "DOC:modules/administracao/usuarios/f-alterar-perfil-do-usuario.md#API"
      ],
      "apf": {
        "pf": 4,
        "tipo": "EE"
      },
      "movimentos": [
        {
          "tipo": "E",
          "entidade": "Usuario",
          "evidencia": [
            "DOC:modules/administracao/usuarios/f-alterar-perfil-do-usuario.md#Campos"
          ],
          "nota": "usuarioId e perfilId"
        },
        {
          "tipo": "R",
          "entidade": "Perfil",
          "evidencia": [
            "DOC:modules/administracao/usuarios/f-alterar-perfil-do-usuario.md#Memória de cálculo"
          ],
          "nota": "opções e validação"
        },
        {
          "tipo": "X",
          "entidade": "Perfil",
          "evidencia": [
            "DOC:modules/administracao/usuarios/f-alterar-perfil-do-usuario.md#API"
          ],
          "nota": "combobox e nome do perfil na resposta"
        },
        {
          "tipo": "R",
          "entidade": "Usuario",
          "evidencia": [
            "DOC:modules/administracao/usuarios/f-alterar-perfil-do-usuario.md#Regras de negócio"
          ],
          "nota": "regra 2: ao menos um Administrador ativo — lê para decidir"
        },
        {
          "tipo": "W",
          "entidade": "Usuario",
          "evidencia": [
            "DOC:modules/administracao/usuarios/f-alterar-perfil-do-usuario.md#Dados lidos e gravados"
          ]
        },
        {
          "tipo": "W",
          "entidade": "EventoAuditoria",
          "evidencia": [
            "DOC:modules/administracao/usuarios/f-alterar-perfil-do-usuario.md#Campos automáticos"
          ],